{
  "$schema": "../motion-meta.schema.json",
  "specVersion": "0.1",
  "id": "cmu_60_01",
  "name": "60_01",
  "description": "salsa",
  "duration": 4.0,
  "sourceFps": 120,
  "license": {
    "spdx": "LicenseRef-CMU-Mocap",
    "url": "http://mocap.cs.cmu.edu/faqs.php",
    "attribution": "The data used in this project was obtained from mocap.cs.cmu.edu. The database was created with funding from NSF EIA-0196217.",
    "source": {
      "kind": "mocap",
      "url": "http://mocap.cs.cmu.edu/",
      "originalId": "60_01",
      "originalFormat": "bvh",
      "converter": "open-vrma/cmu2vrma@0.1"
    }
  },
  "tags": {
    "kind": "dance",
    "genre": [
      "salsa",
      "latin"
    ],
    "energy": 3,
    "bodyParts": [
      "full"
    ],
    "locomotion": "stepping",
    "facing": "front",
    "mood": [
      "festive",
      "energetic"
    ],
    "sections": [
      "verse",
      "chorus"
    ],
    "songTempo": [
      "mid",
      "fast"
    ],
    "fingers": false,
    "rootMotion": true
  },
  "tempo": {
    "bpm": 120,
    "basis": "steps",
    "alternatives": [
      60,
      240
    ],
    "beatsPerBar": 4,
    "firstBeat": 0.0,
    "confidence": 0.62
  },
  "loop": {
    "in": 0.0,
    "out": 4.0,
    "beats": 8,
    "mode": "cycle",
    "blend": 0.1,
    "poseDiffDeg": 6
  },
  "root": {
    "netTravel": 0.1,
    "maxTravel": 0.6,
    "netTurnDeg": 4,
    "turnRangeDeg": 40,
    "hipsBounce": 0.05
  },
  "poses": {
    "start": "stand",
    "end": "stand",
    "startSupport": "both",
    "endSupport": "both",
    "startArms": "down",
    "endArms": "down"
  },
  "retarget": {
    "restPose": "T",
    "sourceHipHeight": 0.95,
    "floorAligned": true,
    "checkedOn": [
      "vrm1-sample",
      "maru",
      "oomofu"
    ]
  },
  "allow": {
    "stretch": {
      "mode": "beats",
      "minRate": 0.75,
      "maxRate": 1.33
    },
    "mirror": true,
    "lookAt": "override",
    "expression": "override",
    "additive": false,
    "parts": {
      "upperBody": "replaceable",
      "lowerBody": "keep"
    }
  },
  "events": [
    {
      "t": 0.0,
      "type": "contact",
      "side": "left"
    },
    {
      "t": 0.5,
      "type": "contact",
      "side": "right"
    },
    {
      "t": 2.0,
      "type": "cue",
      "name": "clap"
    },
    {
      "t": 3.0,
      "type": "hit",
      "name": "決めポーズ",
      "hold": 0.5
    }
  ],
  "ranges": [
    {
      "from": 0.0,
      "to": 2.0,
      "type": "phrase",
      "name": "A",
      "energy": 3
    },
    {
      "from": 2.0,
      "to": 4.0,
      "type": "phrase",
      "name": "B",
      "energy": 4
    },
    {
      "from": 0.0,
      "to": 0.25,
      "type": "footLock",
      "side": "left"
    },
    {
      "from": 0.5,
      "to": 0.75,
      "type": "footLock",
      "side": "right"
    },
    {
      "from": 3.0,
      "to": 3.5,
      "type": "noStretch"
    },
    {
      "from": 0.0,
      "to": 2.0,
      "type": "interruptible"
    }
  ],
  "curves": {
    "footLock.left": [
      [
        0.0,
        1
      ],
      [
        0.2,
        1
      ],
      [
        0.25,
        0
      ]
    ]
  },
  "provenance": {
    "tags": "model",
    "tempo": "auto",
    "events": "auto",
    "ranges": "human",
    "allow": "human",
    "root": "auto",
    "poses": "auto"
  }
}
